### ISSUE TITLE
Ignore `ENOTCONN` in `poll_shutdown`?

### ISSUE THREAD

**Issue by krallin** [sfackler/tokio-openssl#27]
Consider the following case:

- We have a TLS connection with a client
- The client sends us a FIN
- We shutdown the socket for writes
- Then we close it

This is exactly what Hyper will do to shutdown down a connection :)

In this scenario, `SslStream` will actually attempt a write in `poll_shutdown`, to write the OpenSSL-level ACK. Then, it'll call `poll_shutdown` on the underlying socket. However, at this point, the client has already sent us FIN, so they're not expecting any further data. As a result, we get a `ENOTCONN` error.

Would it make sense for this crate to just swallow it and return?

For context, here is a tcpdump of what this exchange looks like:

```
09:46:47.722022 IP6 host.50004 > host.20667: Flags [SEW], seq 2183854800, win 62500, options [mss 65476,sackOK,TS val 456910976 ecr 0,nop,wscale 10], length 0
09:46:47.722034 IP6 host.20667 > host.50004: Flags [S.E], seq 3673805972, ack 2183854801, win 62500, options [mss 65476,sackOK,TS val 456910976 ecr 456910976,nop,wscale 10], length 0
09:46:47.722047 IP6 host.50004 > host.20667: Flags [.], ack 1, win 62, options [nop,nop,TS val 456910976 ecr 456910976], length 0
09:46:47.738564 IP6 host.50004 > host.20667: Flags [P.], seq 1:518, ack 1, win 62, options [nop,nop,TS val 456910993 ecr 456910976], length 517
09:46:47.738575 IP6 host.20667 > host.50004: Flags [.], ack 518, win 63, options [nop,nop,TS val 456910993 ecr 456910993], length 0
09:46:47.739387 IP6 host.20667 > host.50004: Flags [P.], seq 1:3654, ack 518, win 63, options [nop,nop,TS val 456910994 ecr 456910993], length 3653
09:46:47.739399 IP6 host.50004 > host.20667: Flags [.], ack 3654, win 189, options [nop,nop,TS val 456910994 ecr 456910994], length 0
09:46:47.740978 IP6 host.50004 > host.20667: Flags [P.], seq 518:2910, ack 3654, win 189, options [nop,nop,TS val 456910995 ecr 456910994], length 2392
09:46:47.741025 IP6 host.20667 > host.50004: Flags [.], ack 2910, win 190, options [nop,nop,TS val 456910995 ecr 456910995], length 0
09:46:47.742608 IP6 host.20667 > host.50004: Flags [P.], seq 3654:3705, ack 2910, win 190, options [nop,nop,TS val 456910997 ecr 456910995], length 51
09:46:47.742925 IP6 host.50004 > host.20667: Flags [P.], seq 2910:3048, ack 3705, win 189, options [nop,nop,TS val 456910997 ecr 456910997], length 138
09:46:47.744586 IP6 host.20667 > host.50004: Flags [P.], seq 3705:3810, ack 3048, win 195, options [nop,nop,TS val 456910999 ecr 456910997], length 105
09:46:47.785497 IP6 host.50004 > host.20667: Flags [.], ack 3810, win 189, options [nop,nop,TS val 456911040 ecr 456910999], length 0
09:46:47.785507 IP6 host.20667 > host.50004: Flags [P.], seq 3810:3849, ack 3048, win 195, options [nop,nop,TS val 456911040 ecr 456911040], length 39
09:46:47.785512 IP6 host.50004 > host.20667: Flags [.], ack 3849, win 189, options [nop,nop,TS val 456911040 ecr 456911040], length 0
09:46:47.786143 IP6 host.50004 > host.20667: Flags [P.], seq 3048:3079, ack 3849, win 189, options [nop,nop,TS val 456911040 ecr 456911040], length 31
09:46:47.787232 IP6 host.50004 > host.20667: Flags [F.], seq 3079, ack 3849, win 189, options [nop,nop,TS val 456911042 ecr 456911040], length 0
09:46:47.787258 IP6 host.20667 > host.50004: Flags [P.], seq 3849:3880, ack 3080, win 195, options [nop,nop,TS val 456911042 ecr 456911040], length 31
09:46:47.787284 IP6 host.50004 > host.20667: Flags [R], seq 2183857880, win 0, length 0
```

And here is what it looks like in strace:

```
[pid 3637131] sendto(472, "\25\3\3\0\32:G\216\3115c)\267%i\7\1\252eh\367\307\200\324\2740%\320\307Z\254", 31, MSG_NOSIGNAL, NULL, 0 <unfinished ...>
[pid 3637131] <... sendto resumed>)     = 31
[pid 3637131] shutdown(472, SHUT_WR <unfinished ...>
[pid 3637131] <... shutdown resumed>)   = -1 ENOTCONN (Transport endpoint is not connected.)
```

**Comment by sfackler** [comment]
It seems like a change would be best made in TcpStream itself, rather than every stream type that could wrap a TcpStream.

**Comment by krallin** [comment]
> It seems like a change would be best made in TcpStream itself, rather than every stream type that could wrap a TcpStream.

I see where you're coming from, but isn't this behavior a little specific to `tokio-openssl`, in the sense that `SslStream::poll_shutdown` is the method that actually does the write via its call to `shutdown()` (which sends an ACK to the peer)?

**Comment by sfackler** [comment]
But poll_shutdown is probably not the only source of writes to the inner stream - the ACK could come from any one of those instead.

**Comment by krallin** [comment]
Sure, but presumably a failure in any of those methods cannot be simply ignored since there's no way to tell if those errors can be safely ignored or must be propagated. The `poll_shutdown` case seems a little different: we're effectively telling the callsite "shutdown failed: we tried to shutdown but that failed because you're already shutdown" . 

That effectivelyless means you can't successfully shutdown in reaction to your client sending you a FIN on a connection that was otherwise idle until then: in that case, `poll_shutdown` will attempt to write and hit an error.

To be clear, this _is_ trivial to workaround by just wrapping `SslStream` with an `AsyncWrite` implementation that ignores the error. I figured you might want to know about this little pitfall, but it it feels out of scope to fix that's entirely fair :)

**Comment by sfackler** [comment]
In the strace you provided, the write from the TLS shutdown did not produce an error, only the call to shutdown did. I don't see why you wouldn't end up in the same place with the last normal write with some other stream wrapper.

**Comment by krallin** [comment]
> In the strace you provided, the write from the TLS shutdown did not produce an error, only the call to shutdown did. I don't see why you wouldn't end up in the same place with the last normal write with some other stream wrapper.

I'm not sure I really follow what you mean here. If e.g. my connection is currently idle and I receive a FIN from the other end of the connection (which translates as EOF when I attempt to read), and I shut down in response, then I don't actually have other writes going on.

In this particular scenario, my client has actually received the last "normal" write I had to send them (this is in a HTTP server, and they're just closing their read pipe after an idle timeout).

Granted, if my client hangs up as I'm writing to them, then I would have also gotten an error, yes (and that seems expected). However, here I'm getting an error even if I'm trying to close the connection cleanly. I don't get one if I skip the SSL writing bits. I suspect the reason the error shows up in the call to shudown is because the call to write just buffers it.

Ideally, we could check if the connection is willing to accept writes when attempting shutdown ... but given the API is generic over AsyncWrite, this not really possible. I'm not really an obvious solution here so, I'll close the issue :)
